pub_date	title	venue	excerpt	citation	url_slug	paper_url	
2022-01-25	Clinical Applications of 4D Flow MRI in the Portal Venous System	Clinical Applications of 4D Flow MRI in the Portal Venous System		"Oechtering, T. H., <b> Roberts, G. S. <b>, Panagiotopoulos, N., Wieben, O., Reeder, S. B., & Roldán-Alzate, A. (2022). ""linical Applications of 4D Flow MRI in the Portal Venous System"". <i> Magn Reson Med Sci <i>, 21(2), 340-353. doi:10.2463/mrms.rev.2021-0105d"	portal	http://academicpages.github.io/files/PV_4Dflow_review.pdf	
2021-12-31	Virtual injections using 4D flow MRI with displacement corrections and constrained probabilistic streamlines	Magnetic Resonance in Medicine		"<b> Roberts, G. S. <b>, Loecher, M. W., Spahic, A., Johnson, K. M., Turski, P. A., Eisenmenger, L. B., & Wieben, O. (2022). ""Virtual injections using 4D flow MRI with displacement corrections and constrained probabilistic streamlines"". <i> Magn Reson Med <i>, 87(5), 2495-2511. doi:https://doi.org/10.1002/mrm.29134"	vi	http://academicpages.github.io/files/virtual_injection.pdf	
2021-11-27	Abdominal applications of quantitative 4D flow MRI	Abdominal Radiology		"Oechtering, T. H., <b> Roberts, G. S. <b>, Panagiotopoulos, N., Wieben, O., Roldán-Alzate, A., & Reeder, S. B. (2021). ""bdominal applications of quantitative 4D flow MRI"". <i> Abdom Radiol<i>. doi:10.1007/s00261-021-03352-ww"	abd	http://academicpages.github.io/files/abd_4Dflow_review.pdf	
2021-10-21	Exercise-induced irregular right heart flow dynamics in adolescents and young adults born preterm	Journal of Cardiovascular Magnetic Resonance		"Macdonald, J. A., <b> Roberts, G. S. <b>, Corrado, P. A., Beshish, A. G., Haraldsdottir, K., Barton, G. P., . . . Wieben, O. (2021). ""Exercise-induced irregular right heart flow dynamics in adolescents and young adults born preterm"". <i> J Cardiovasc Magn Reson <i>, 23(1), 116. doi:10.1186/s12968-021-00816-2"	eldridge	http://academicpages.github.io/files/eldridge_preterm_study.pdf	
2021-2-6	Non-invasive assessment of mesenteric hemodynamics in patients with suspected chronic mesenteric ischemia using 4D flow MRI	Abdominal Radiology		"<b> Roberts, G. S. <b>, Fran?ois, C. J., Starekova, J., Roldán-Alzate, A., & Wieben, O. (2022). ""on-invasive assessment of mesenteric hemodynamics in patients with suspected chronic mesenteric ischemia using 4D flow MRI"".<i> Abdom Radiol <i>, 47(5), 1684-1698. doi:10.1007/s00261-020-02900-00"	cmi	http://academicpages.github.io/files/mesenteric_ischemia.pdf	
							
							
							
